{
  "$schema":"https://json-schema.org/draft/2020-12/schema",
  "$id":"https://mwm.local/schemas/eqa/dependency-node.schema.json",
  "title":"EQA Dependency Node",
  "type":"object",
  "additionalProperties":false,
  "required":["node_id","family","skill_id","stage","status","preconditions","input_artifact_ids","expected_output_schema","versions","consumer_node_ids","failure_states","owner","release_effect"],
  "properties":{
    "node_id":{"type":"string","pattern":"^EQA-NODE-"},"family":{"type":"string"},"skill_id":{"type":"string"},"stage":{"type":"string"},"status":{"type":"string","enum":["eligible","deferred","running","completed","blocked","stale"]},"preconditions":{"type":"array","items":{"type":"object","required":["precondition_id","status","evidence"],"properties":{"precondition_id":{"type":"string"},"status":{"type":"string","enum":["pass","fail","unknown","not_applicable"]},"evidence":{"type":"string"}}}},"input_artifact_ids":{"type":"array","items":{"type":"string"}},"expected_output_schema":{"type":"string"},"versions":{"type":"object","additionalProperties":false,"required":["specification","rules","source_bundle","route"],"properties":{"specification":{"type":"string"},"rules":{"type":"string"},"source_bundle":{"type":"string"},"route":{"type":"string"},"baseline":{"type":["string","null"]}}},"consumer_node_ids":{"type":"array","items":{"type":"string"}},"failure_states":{"type":"array","items":{"type":"string"}},"owner":{"type":"string"},"release_effect":{"type":"string","enum":["none","track","hold","block"]},"defer_reason":{"type":["string","null"]}
  }
}
