{"node_id":"EQA-NODE-CE-001","family":"Copyediting","skill_id":"CE","stage":"editorial_review","status":"eligible","preconditions":[{"precondition_id":"CE-PRE-1","status":"pass","evidence":"approved text present"}],"input_artifact_ids":["ART-CH"],"expected_output_schema":"CE-output.schema.json","versions":{"specification":"CE-0.1.0","rules":"CE-RULES-0.1.0","source_bundle":"bundle-v1","route":"local-model-v1","baseline":null},"consumer_node_ids":["EQA-NODE-CPR-001"],"failure_states":["blocked","awaiting_human","stale"],"owner":"CE owner","release_effect":"track","defer_reason":null}
